{
  "schemaVersion": "1.0.0",
  "kind": "weaponDefinition",
  "weaponDefinitionId": 5,
  "name": "Crystal Axe",
  "weaponClass": 2,
  "damageType": 7,
  "techTier": 2,
  "requiredLevel": 3,
  "requiredTechTier": 2,
  "minDamage": 20,
  "maxDamage": 31,
  "attackSpeed": 8,
  "critChanceBps": 500,
  "critMultiplierBps": 16800,
  "accuracyBps": 9000,
  "range": 2,
  "maxDurability": 150,
  "armorPenBps": 300,
  "blockChanceBps": 0,
  "lifeStealBps": 0,
  "energyCost": 2,
  "heatGeneration": 0,
  "stability": 84,
  "cooldownMs": 1100,
  "projectileSpeed": 0,
  "aoeRadius": 0,
  "enchantmentSlots": 2,
  "materiaSlots": 1,
  "visualVariant": 1,
  "maxUpgradeLevel": 8,
  "familySetId": 5,
  "enabled": true,
  "metadataRevision": 1,
  "verificationStatus": "confirmed",
  "notes": "Synced from live CityWeapons."
}
