{
    "schemaVersion": "1.0.0",
    "kind": "weaponDefinition",
    "weaponDefinitionId": 1,
    "name": "Iron Sword",
    "slug": "iron-sword",
    "description": "Basic physical starter weapon definition used in the live Inpinity City weapon system.",
    "weaponClass": 1,
    "damageType": 1,
    "techTier": 1,
    "requiredLevel": 1,
    "requiredTechTier": 1,
    "minDamage": 12,
    "maxDamage": 18,
    "attackSpeed": 10,
    "critChanceBps": 300,
    "critMultiplierBps": 15000,
    "accuracyBps": 9200,
    "range": 2,
    "maxDurability": 120,
    "armorPenBps": 100,
    "blockChanceBps": 0,
    "lifeStealBps": 0,
    "energyCost": 0,
    "heatGeneration": 0,
    "stability": 90,
    "cooldownMs": 900,
    "projectileSpeed": 0,
    "aoeRadius": 0,
    "enchantmentSlots": 1,
    "materiaSlots": 1,
    "visualVariant": 1,
    "maxUpgradeLevel": 7,
    "familySetId": 1,
    "metadataRevision": 1,
    "enabled": true,
    "verificationStatus": "confirmed",
    "notes": "Confirmed from live CityWeapons weaponDefinitionOf(1).",
    "display": {
      "weaponClassLabel": "Sword",
      "damageTypeLabel": "Physical",
      "techTierLabel": "Primitive"
    }
  }