{
    "schemaVersion": "1.0.0",
    "kind": "weaponDefinition",
    "weaponDefinitionId": 2,
    "name": "Crystal Bow",
    "slug": "crystal-bow",
    "description": "Crystal-aligned ranged weapon definition used in the live Inpinity City weapon system.",
    "weaponClass": 13,
    "damageType": 7,
    "techTier": 2,
    "requiredLevel": 3,
    "requiredTechTier": 2,
    "minDamage": 16,
    "maxDamage": 24,
    "attackSpeed": 9,
    "critChanceBps": 700,
    "critMultiplierBps": 16500,
    "accuracyBps": 9500,
    "range": 14,
    "maxDurability": 100,
    "armorPenBps": 250,
    "blockChanceBps": 0,
    "lifeStealBps": 0,
    "energyCost": 2,
    "heatGeneration": 0,
    "stability": 82,
    "cooldownMs": 1100,
    "projectileSpeed": 18,
    "aoeRadius": 0,
    "enchantmentSlots": 2,
    "materiaSlots": 1,
    "visualVariant": 1,
    "maxUpgradeLevel": 7,
    "familySetId": 2,
    "metadataRevision": 1,
    "enabled": true,
    "verificationStatus": "confirmed",
    "notes": "Confirmed from live CityWeapons weaponDefinitionOf(2). Crystal Bow uses weaponClass 13 = Crystal Bow.",
    "display": {
      "weaponClassLabel": "Crystal Bow",
      "damageTypeLabel": "Crystal",
      "techTierLabel": "Refined"
    }
  }