{
    "schemaVersion": "1.0.0",
    "kind": "weaponDefinition",
    "weaponDefinitionId": 3,
    "name": "Plasma Rifle",
    "slug": "plasma-rifle",
    "description": "High-tech plasma weapon definition used in the live Inpinity City weapon system.",
    "weaponClass": 9,
    "damageType": 11,
    "techTier": 4,
    "requiredLevel": 8,
    "requiredTechTier": 4,
    "minDamage": 28,
    "maxDamage": 40,
    "attackSpeed": 8,
    "critChanceBps": 500,
    "critMultiplierBps": 17000,
    "accuracyBps": 9600,
    "range": 20,
    "maxDurability": 140,
    "armorPenBps": 500,
    "blockChanceBps": 0,
    "lifeStealBps": 0,
    "energyCost": 8,
    "heatGeneration": 12,
    "stability": 75,
    "cooldownMs": 1300,
    "projectileSpeed": 26,
    "aoeRadius": 1,
    "enchantmentSlots": 2,
    "materiaSlots": 2,
    "visualVariant": 1,
    "maxUpgradeLevel": 9,
    "familySetId": 3,
    "metadataRevision": 1,
    "enabled": true,
    "verificationStatus": "confirmed",
    "notes": "Confirmed from live CityWeapons weaponDefinitionOf(3). Plasma Rifle uses weaponClass 9 = Plasma Rifle.",
    "display": {
      "weaponClassLabel": "Plasma Rifle",
      "damageTypeLabel": "Plasma",
      "techTierLabel": "High-Tech"
    }
  }